26.033.357-7,Rafael Eduardo Soto Pinto,PRE-KINDER ,Daniela ,Colegio Lucila Godoy,2022-08-16T21:31:28.000Z,2,1,2,2,2,2,2,1,3,2,2,1,3,3,3,3,3,1,1,3,2,1,1,2,2,"Si, me preocupa su timidez al ir al colegio y no le gusta mucho trabjar en las tareas indicadas.",3,3,3,3,2,2,2,2
25.912.633-9,Alfredo Ignacio Suazo Sandoval,PRE-KINDER ,Daniela ,Colegio Lucila Godoy,2022-08-16T21:31:28.000Z,3,2,1,3,1,1,2,1,3,2,2,1,1,3,2,1,3,1,1,2,2,1,1,1,2,0,1,0,0,0,0,0,0,0
26.180.846-3,Simón Santiago Urra Retamal,PRE-KINDER ,Daniela ,Colegio Lucila Godoy,2022-08-16T21:31:28.000Z,2,2,1,3,3,1,2,1,1,3,3,1,1,3,3,1,2,1,1,2,2,1,2,1,2,Se frustra y se pone de mal genio cuando algo no le resulta como el quiere.,1,0,0,0,0,0,0,0
25.907.968-3,Maximiliano Andrés Vergara Castro,PRE-KINDER ,Daniela ,Colegio Lucila Godoy,2022-08-16T21:31:57.000Z,3,2,1,3,2,1,2,1,3,2,3,1,1,3,2,1,3,1,1,2,2,1,2,1,2,0,2,2,1,2,1,2,1,1
25.870.952-7,Lucas Ignacio Zamorano Garrido,PRE-KINDER ,Daniela ,Colegio Lucila Godoy,2022-08-16T21:31:57.000Z,3,2,1,3,1,1,2,1,3,3,3,1,1,3,3,1,3,1,1,3,2,1,2,1,1,0,2,2,1,1,1,2,1,1
25823979-2,Matías Rodrigo Basoalto Villar,PRE-KINDER A,Daniela ,Escuela España Linares,2022-08-17T09:10:06.000Z,3,2,1,2,2,1,2,1,2,2,1,1,1,3,2,1,3,1,1,1,2,1,1,1,2,No,2,1,1,1,2,2,4,1
25772815-3,Facundo Beltrán  Castro Rojas,PRE-KINDER A,Daniela ,Escuela España Linares,2022-08-17T09:10:06.000Z,3,2,1,2,2,2,3,1,2,2,3,1,1,3,2,1,3,1,1,3,2,1,2,1,2,0,1,0,1,1,1,1,1,1
100579285-8,Meiffel Fransheska de los Santos Catalbiano López,PRE-KINDER A,Daniela ,Escuela España Linares,2022-08-17T09:10:06.000Z,3,2,1,3,2,1,2,1,0,3,3,3,1,1,2,2,2,3,2,3,1,1,2,2,2,0,1,0,2,1,1,1,1,1
25866278-4,Alonso Renato Contreras Leiva,PRE-KINDER A,Daniela ,Escuela España Linares,2022-08-17T09:10:06.000Z,3,2,1,2,2,2,2,1,3,2,1,1,1,3,3,2,3,1,1,2,2,1,3,1,2,0,2,2,2,4,2,4,2,1
25987905-1,César Alejandro Freire Ávalos,PRE-KINDER A,Daniela ,Escuela España Linares,2022-08-17T09:10:06.000Z,3,2,1,3,2,1,2,1,3,2,2,1,1,3,2,3,3,1,2,3,2,1,2,2,2,0,2,3,3,2,3,0,2,2
25792817-9,Martín Ignacio Gallardo Mestre,PRE-KINDER A,Daniela ,Escuela España Linares,2022-08-17T09:10:06.000Z,2,2,1,3,2,2,2,1,2,3,2,1,1,3,3,1,3,1,2,2,1,1,1,1,2,0,2,3,1,2,1,0,1,1
26074428-3,Tomás Alexander Moore Bustos,PRE-KINDER A,Daniela ,Escuela España Linares,2022-08-17T09:10:06.000Z,3,2,1,2,2,2,2,1,3,2,3,2,1,3,2,2,3,1,2,3,2,1,2,3,2,0,2,0,1,1,1,1,1,1
26048731-0,Darcy Abigail Moreno Bucker,PRE-KINDER A,Daniela ,Escuela España Linares,2022-08-17T09:10:06.000Z,3,1,1,3,1,2,3,1,3,1,3,1,1,3,1,1,3,1,1,3,2,1,2,1,3,0,1,0,0,0,0,0,0,0
26112073-9,Rodrigo Alfonso Norambuena Martini,PRE-KINDER A,Daniela ,Escuela España Linares,2022-08-17T09:10:06.000Z,2,3,1,2,2,2,2,1,2,2,1,1,1,2,3,1,3,1,1,2,2,1,2,1,1,Solo a rodrigo alfonso le falta interaccion con mas niños y la pandemia hizo que el se atrasara en su aprendizaje.,3,3,1,1,2,2,2,2
25853389-5,Aranza Yaslin Sobarzo Riveros,PRE-KINDER A,Daniela ,Escuela España Linares,2022-08-17T09:10:06.000Z,2,3,1,2,3,1,2,1,2,3,1,1,1,2,2,1,3,1,1,2,2,1,2,2,2,0,1,0,0,0,0,0,0,0
26154683-3,Jacinta Isabella Urrutia Oyarzün,PRE-KINDER A,Daniela ,Escuela España Linares,2022-08-17T09:10:06.000Z,3,1,1,3,1,1,2,1,3,2,3,1,1,3,1,1,3,1,1,3,3,1,1,1,2,0,1,0,0,0,0,0,0,0
100575834-k,Seline Valladares Castillo,PRE-KINDER A,Daniela ,Escuela España Linares,2022-08-17T09:10:06.000Z,3,2,2,3,2,2,3,1,3,2,3,2,1,3,2,1,3,1,1,3,2,1,1,2,2,no,2,3,2,1,1,1,1,1
26140885-6,Agustín Andrés Zurita Monsalve,PRE-KINDER A,Daniela ,Escuela España Linares,2022-08-17T09:10:06.000Z,3,3,2,2,2,1,2,1,3,2,2,1,1,3,1,2,3,1,1,3,2,1,2,2,2,0,1,0,0,0,0,0,0,0
26093255-1,Ana Valentina Riquelme San Martin,PRE-KINDER A,Daniela ,Escuela España Linares,2022-08-17T09:10:06.000Z,3,1,1,2,1,2,3,1,3,1,2,1,1,3,1,1,3,1,1,3,3,1,2,1,3,0,2,3,1,1,2,3,1,1
