rut,alumno,curso,evaluador,colegio,fecha,pregunta_1,pregunta_2,pregunta_3,pregunta_4,pregunta_5,pregunta_6,pregunta_7,pregunta_8,pregunta_9,pregunta_10,pregunta_11,pregunta_12,pregunta_13,pregunta_14,pregunta_15,pregunta_16,pregunta_17,pregunta_18,pregunta_19,pregunta_20,pregunta_21,pregunta_22,pregunta_23,pregunta_24,pregunta_25,pregunta_26,pregunta_27,pregunta_28,pregunta_29,pregunta_30,pregunta_30,pregunta_30,pregunta_30,pregunta_31
21928958-2,Javier Pérez,PRE - KINDER B,Alonso Anavalon,Colegio de Prueba - 2,2022-07-27T20:22:31.000Z,1,2,0,0,0,0,0,0,0,0,0,0,0,0,0,0,0,0,0,0,0,0,0,0,0,0,0,0,0,0,0,0,0,0
20728918-3,Gabriela Contreras,PRE - KINDER A,Alonso Anavalon,Colegio de Prueba - 1,2022-07-27T23:11:26.000Z,0,0,0,0,0,0,0,0,0,0,0,0,0,0,0,0,0,0,0,0,0,0,0,0,0,0,0,0,0,0,0,0,0,0
20688918-1,Marcelo Rojas,PRE - KINDER A,Alonso Anavalon,Colegio de Prueba - 1,2022-07-27T23:57:45.000Z,1,1,1,0,0,0,0,0,0,0,0,0,0,0,0,0,0,0,0,0,0,0,0,0,0,0,0,0,0,0,0,0,0,0
25.935.027-1,Trinidad Helena Soto Valencia,PRE-KINDER ,Daniela ,Colegio Lucila Godoy,2022-07-30T01:58:22.000Z,3,3,1,2,3,1,2,1,2,3,2,2,1,2,3,1,2,1,1,2,1,1,1,1,1,Me preocupa que la sobreestimulación que tienen los niños hoy sea lo que los haga ser hiperactivos o que les cueste concentrarse. Como manejar eso.,2,3,1,2,2,3,1,2
25.825.705-7,Amaro Alonso Hidalgo Méndez,PRE-KINDER ,Daniela ,Colegio Lucila Godoy,2022-07-30T01:58:22.000Z,3,3,2,3,2,1,2,2,1,3,1,1,2,1,2,2,3,2,1,1,1,1,1,2,1,0,2,2,2,4,4,2,2,3
26.153.069-4,Aurora Ignacia Molina Martínez,PRE-KINDER ,Daniela ,Colegio Lucila Godoy,2022-07-30T01:58:22.000Z,3,2,1,3,2,1,2,1,2,2,3,1,1,3,2,1,3,1,1,2,2,1,1,2,2,No,1,0,0,0,0,0,0,0
25.850.573-5,Sofia Antonia Saavedra Anabalon,PRE-KINDER ,Daniela ,Colegio Lucila Godoy,2022-07-30T01:58:22.000Z,3,3,1,3,1,3,2,1,2,1,3,1,1,3,2,1,3,1,1,3,2,1,3,1,2,No mucho solo el lenguaje,1,0,0,1,1,2,1,1
25.909.977-3,Vicente Alejandro Castillo Gonzalez,PRE-KINDER ,Daniela ,Colegio Lucila Godoy,2022-07-30T01:58:22.000Z,3,2,2,2,3,2,2,1,2,2,3,2,2,2,2,3,2,1,1,3,2,1,1,1,2,Solo agregar que mi hijo es un poco nervioso y llora cuando no hacenlo que el quiere,2,3,2,2,2,1,1,1
25.798.233-5,Vicente Maximiliano Sepúlveda Gaete,PRE-KINDER ,Daniela ,Colegio Lucila Godoy,2022-07-30T01:58:22.000Z,2,2,1,3,1,1,2,1,3,2,3,1,1,2,3,1,3,1,1,2,2,1,1,2,2,0,1,0,0,0,0,0,0,0
26.115.126-K,Bastián Tobías Alcaino Rojas,PRE-KINDER ,Daniela ,Colegio Lucila Godoy,2022-07-30T01:58:22.000Z,3,3,1,3,1,2,3,1,3,3,3,1,1,3,3,1,3,1,1,3,2,1,2,1,3,"Bastian siempre ha sido demasiado sociable desde pequeño bueno y malo, por los riesgos que eso puede entregar. Muy cariñoso.",1,0,0,0,0,0,0,0
25.932.454-8,Jesús Julián Carrasco Serey,PRE-KINDER ,Daniela ,Colegio Lucila Godoy,2022-07-30T01:58:22.000Z,3,3,1,2,3,2,3,1,3,3,1,1,1,3,3,2,3,1,1,1,1,1,1,1,1,0,3,3,2,2,2,4,2,2
25.921.951-5,Julieta Ignacia Barrueto Vásquez,PRE-KINDER ,Daniela ,Colegio Lucila Godoy,2022-07-30T02:26:27.000Z,2,0,1,2,2,0,2,1,3,1,2,1,0,2,2,2,3,1,1,2,2,1,2,2,2,Solo tengo preocupacion por como se lleva con sus compa;eros en socil y por sus miedos,2,3,2,1,2,1,2,2
20725918-3,Sergio Rojas,PRE - KINDER A,Esperanza ,Colegio de Prueba - 1,2022-07-30T02:26:58.000Z,0,0,0,0,0,0,0,0,0,0,0,0,0,0,0,0,0,0,0,0,0,0,0,0,0,0,0,0,0,0,0,0,0,0
21028918-9,Camila Gonzalez,PRE - KINDER A,Alonso Anavalon,Colegio de Prueba - 1,2022-08-02T17:33:26.000Z,1,0,0,0,0,0,0,0,0,0,0,0,0,0,0,0,0,0,0,0,0,0,0,0,0,0,0,0,0,0,0,0,0,0
20798918-3,Marta Muñoz,PRE - KINDER A,Alonso Anavalon,Colegio de Prueba - 1,2022-08-02T17:46:53.000Z,0,0,0,0,0,0,0,0,0,0,0,0,0,0,0,0,0,0,0,0,0,0,0,0,0,0,0,0,0,0,0,0,0,0
20428918-3,Marcela Contreras,PRE - KINDER B,Alonso Anavalon,Colegio de Prueba - 2,2022-08-03T01:55:46.000Z,0,0,0,0,0,0,0,0,0,0,0,0,0,0,0,0,0,0,0,0,0,0,0,0,0,0,0,0,0,0,0,0,0,0
21052918-1,Angelmo Fuentes,PRE - KINDER B,Alonso Anavalon,Colegio de Prueba - 2,2022-08-03T02:11:58.000Z,0,0,0,0,0,2,2,2,0,0,0,0,0,0,0,0,0,0,0,0,0,0,0,0,0,0,0,0,0,0,0,0,0,0
20788918-6,Ana Alba,PRE - KINDER A,Alonso Anavalon,Colegio de Prueba - 1,2022-08-03T02:11:59.000Z,0,0,0,0,0,0,0,0,0,0,0,0,0,0,0,0,0,0,0,0,0,0,0,0,0,0,0,0,0,0,0,0,0,0
21002918-1,Jorge Fuentes,PRE - KINDER A,Alonso Anavalon,Colegio de Prueba - 1,2022-08-03T02:17:07.000Z,2,0,0,0,0,0,0,0,0,0,0,0,0,0,0,0,0,0,0,0,0,0,0,0,0,0,0,0,0,0,0,0,0,0
20725761-3,Hugo Rojas,PRE - KINDER B,Alonso Anavalon,Colegio de Prueba - 2,2022-08-03T02:37:32.000Z,1,1,0,0,0,0,0,0,0,0,0,0,0,0,0,0,0,0,0,0,0,0,0,0,0,0,0,0,0,0,0,0,0,0
20721918-3,Cristobal Quinteros,PRE - KINDER A,Alonso Anavalon,Colegio de Prueba - 1,2022-08-03T02:40:42.000Z,0,0,0,0,0,0,0,0,0,0,0,0,0,0,0,0,0,0,0,0,0,0,0,0,0,0,0,0,0,0,0,0,0,0
20788918-1,Gabriel Rojas,PRE - KINDER B,Alonso Anavalon,Colegio de Prueba - 2,2022-08-03T17:00:35.000Z,0,0,0,0,0,0,0,0,0,0,0,0,0,0,0,0,0,0,0,0,0,0,0,0,0,0,0,0,0,0,0,0,0,0
21728958-2,Pedro Pérez,PRE - KINDER A,Alonso Anavalon,Colegio de Prueba - 1,2022-08-03T17:00:36.000Z,0,0,0,0,0,0,0,0,0,0,0,0,0,0,0,0,0,0,0,0,0,0,0,0,0,0,0,0,0,0,0,0,0,0
20122918-5,Petunia Tapia,PRE - KINDER B,Alonso Anavalon,Colegio de Prueba - 2,2022-08-03T17:24:09.000Z,0,0,0,0,0,0,0,0,0,0,0,0,0,0,0,0,0,0,0,0,0,0,0,0,0,0,0,0,0,0,0,0,0,0
25804308-1,Leonardo Miguel Alonso Sobarzo,PRE-KINDER ,Esperanza ,Escuela Centinela,2022-08-10T02:18:35.000Z,3,3,1,3,1,1,2,1,3,3,3,1,1,3,2,2,3,1,1,3,2,1,1,2,2,No,1,0,0,0,0,0,0,0
25833481-7,Bruno Nicolás Cáceres Cancino,PRE-KINDER ,Esperanza ,Escuela Centinela,2022-08-10T02:18:35.000Z,2,2,1,3,2,2,2,1,3,3,3,1,1,3,3,2,3,1,1,2,2,1,1,2,2,"Su concentración, es demasiado disperso. Siento que aprende rápido y se aburre luego.",2,2,1,1,1,1,1,1
25881404-5,Franco Elías Casanova Ayala,PRE-KINDER ,Esperanza ,Escuela Centinela,2022-08-10T02:18:35.000Z,2,1,1,2,1,3,3,1,1,1,3,2,1,3,2,3,3,1,1,2,1,1,3,2,2,0,3,3,2,1,2,1,2,1
26177419-4,Matilde Valentina Gutiérez Ramirez,PRE-KINDER ,Esperanza ,Escuela Centinela,2022-08-10T02:18:35.000Z,3,1,1,2,2,1,2,1,3,3,3,1,1,3,2,1,3,1,1,3,2,1,1,1,2,0,1,0,0,0,0,0,0,0
25869087-7,Florencia Ignacia Izeta Contreras,PRE-KINDER ,Esperanza ,Escuela Centinela,2022-08-10T02:18:35.000Z,3,1,1,3,1,1,3,1,3,1,3,1,1,3,1,1,3,3,1,3,3,1,3,3,3,0,1,0,1,1,1,1,1,1
25745573-4,Lucas David Leal Moya,PRE-KINDER ,Esperanza ,Escuela Centinela,2022-08-10T02:18:35.000Z,2,3,2,3,2,3,3,0,2,2,2,1,1,2,1,1,3,2,2,3,2,1,3,2,3,0,1,0,0,0,0,0,0,0
25943604-4,Damián Alonso Luna Vergara,PRE-KINDER ,Esperanza ,Escuela Centinela,2022-08-10T02:18:35.000Z,3,2,1,3,3,1,3,1,3,2,3,1,1,3,2,1,3,2,1,3,1,1,1,3,2,0,1,0,0,0,0,0,0,0
25944790-9,Sofía Belen Parra Díaz,PRE-KINDER ,Esperanza ,Escuela Centinela,2022-08-10T02:18:35.000Z,2,3,2,2,3,3,2,1,2,3,2,1,1,2,3,3,3,2,1,2,1,2,1,2,2,Se frustra fácilmente ,3,3,2,2,2,2,0,1
26064988-4,Fernanda Paz Torres Orellana,PRE-KINDER ,Esperanza ,Escuela Centinela,2022-08-10T02:18:43.000Z,3,3,1,3,1,1,2,1,3,3,3,1,1,3,3,1,3,1,1,3,2,1,1,1,2,0,1,0,0,0,0,0,0,0
99.999.999-9,Gaspar Valdebenito Alarcon,PRE-KINDER ,Esperanza ,Escuela Huilquilemu,2022-08-10T02:18:43.000Z,3,3,1,2,2,2,2,1,2,2,3,1,1,3,2,1,3,2,1,2,2,1,2,2,2,0,2,2,1,1,1,2,2,2
26.056.620-2,José Miguel Antonio Valdés Ilufi,PRE-KINDER ,Esperanza ,Escuela Huilquilemu,2022-08-10T02:18:43.000Z,3,2,1,3,3,3,2,3,3,3,3,2,2,2,2,2,3,2,1,3,2,1,3,1,2,"Sus miedos.
Preocupaciones.
Sus frustraciones ",2,2,2,1,3,1,1,1
25.883.888-2,Sofía Antonia Ramos Bravo,PRE-KINDER ,Esperanza ,Escuela Huilquilemu,2022-08-10T02:19:50.000Z,2,2,3,2,2,2,1,2,2,3,2,2,2,0,2,3,1,1,1,2,2,1,2,2,3,0,1,0,0,0,0,0,0,0
25.789.907-1,Jefferson Ulises Navarro Hernández,PRE-KINDER ,Esperanza ,Escuela Huilquilemu,2022-08-10T02:19:50.000Z,3,2,1,3,1,1,3,1,3,2,3,1,1,3,2,1,3,1,1,3,3,1,3,2,2,0,2,3,1,1,2,1,2,1
25762087-5,ELÍAS EDUARDO ÁVILA CASANOVA,PRE-KINDER A,Daniela ,Colegio Salesianos Linares,2022-08-15T03:11:10.000Z,0,2,1,2,2,1,3,1,3,2,2,1,1,0,2,1,3,1,1,3,2,1,0,2,3,0,1,0,0,0,0,0,0,0
26193259-8,LUCAS ANDRÉS BUSTOS BELTRÁN,PRE-KINDER A,Daniela ,Colegio Salesianos Linares,2022-08-15T03:11:10.000Z,3,3,1,2,1,2,2,1,3,3,2,1,1,3,3,2,3,1,1,3,2,1,3,2,2,0,1,0,0,0,0,0,0,0
25834903-2,RENATA FERNANDA CARRASCO VIDAL,PRE-KINDER A,Daniela ,Colegio Salesianos Linares,2022-08-15T03:11:17.000Z,3,3,1,2,3,2,2,2,3,3,2,1,1,2,3,1,3,1,1,3,2,1,3,1,1,"La hiperactividad de mi hija, tuvo sesion con fonoaudiologa y se e detecto hiperactividad, eso es lo que mas me preocupa.",3,3,3,1,2,2,2,1
25935839-6,RAFAEL ANTONIO CERDA MANRÍQUEZ,PRE-KINDER A,Daniela ,Colegio Salesianos Linares,2022-08-15T03:11:17.000Z,3,1,1,2,2,1,2,1,3,1,3,1,1,3,1,1,3,1,1,2,3,1,3,3,2,0,2,2,2,2,1,1,2,1
25833793-k,JULIETA DEL ROSARIO CORTÍNEZ YÉVENES,PRE-KINDER A,Daniela ,Colegio Salesianos Linares,2022-08-15T03:11:31.000Z,2,3,1,2,2,1,2,1,2,3,3,2,1,3,2,1,3,1,1,3,2,1,2,2,1,0,2,3,1,3,1,1,2,1
25767111-9,MAXIMILIANO ALONSO ESCALONA VALLEJOS,PRE-KINDER A,Daniela ,Colegio Salesianos Linares,2022-08-15T03:11:31.000Z,3,3,1,2,3,1,1,2,2,3,2,2,2,2,3,2,3,2,1,3,1,1,2,2,2,Preocupacion por hiperactividad y comportaminto,3,2,3,3,3,3,2,2
25782266-4,MÁXIMO GASPAR GATICA GONZÁLEZ,PRE-KINDER A,Daniela ,Colegio Salesianos Linares,2022-08-15T03:11:31.000Z,2,2,1,2,3,1,2,2,2,2,2,3,1,3,2,2,1,2,2,3,2,1,2,2,2,Que pasa si mi hijo particip en el inicio y luego no quiere seguir participando en la actividad,2,3,3,3,2,2,2,2
25760004-1,VALENTINA IGNACIA GONZÁLEZ INOSTROZA,PRE-KINDER A,Daniela ,Colegio Salesianos Linares,2022-08-15T03:11:31.000Z,3,1,1,3,2,1,2,1,3,3,1,1,1,1,2,2,3,1,1,2,2,1,3,2,2,0,1,0,0,0,0,0,0,0
26190391-1,BRUNO LUCIANO GUERRERO ARAVENA,PRE-KINDER A,Daniela ,Colegio Salesianos Linares,2022-08-15T03:11:31.000Z,2,2,1,3,1,2,2,1,2,2,2,1,1,3,2,1,3,1,1,2,2,1,2,1,2,0,1,0,0,0,0,0,0,0
25871029-0,IGNACIO ANDRÉS GUZMÁN PEREIRA,PRE-KINDER A,Daniela ,Colegio Salesianos Linares,2022-08-15T03:11:31.000Z,2,3,1,2,2,1,2,1,2,3,3,2,2,3,3,2,2,1,1,3,1,1,3,2,2,0,2,3,1,1,2,1,1,2
25975967-6,ALFONSO EDUARDO HERNÁNDEZ GANGAS,PRE-KINDER A,Daniela ,Colegio Salesianos Linares,2022-08-15T03:11:31.000Z,1,3,1,2,3,2,2,1,1,3,1,2,2,2,3,1,1,1,1,1,1,1,2,1,2,0,3,3,3,3,3,3,2,1
26038137-7,ALONSO ESTEBAN HERNÁNDEZ GAJARDO,PRE-KINDER A,Daniela ,Colegio Salesianos Linares,2022-08-15T03:11:31.000Z,3,2,1,3,1,1,2,1,3,3,2,2,1,3,2,1,2,1,1,2,2,1,3,1,2,Trabaja mejor con otras personas que con los padres,1,0,0,0,0,0,0,0
25812037-k,MATEO SANTINO LAGOS VILLAGRA,PRE-KINDER A,Daniela ,Colegio Salesianos Linares,2022-08-15T03:11:31.000Z,3,2,0,3,2,2,2,1,2,3,2,1,1,2,2,2,2,1,1,2,2,1,2,2,1,A veces suele tener juegos algo agresivos,3,3,2,2,2,2,2,1
25747207-8,SOFÍA IGNACIA MOLINA VÁSQUEZ,PRE-KINDER A,Daniela ,Colegio Salesianos Linares,2022-08-15T03:11:31.000Z,2,2,1,2,2,3,3,1,3,2,3,1,1,3,1,1,3,1,1,3,2,1,3,1,3,Ninguna,1,0,1,3,3,4,3,1
26123224-3,JOAQUÍN ALONSO MOLINA VÁSQUEZ,PRE-KINDER A,Daniela ,Colegio Salesianos Linares,2022-08-15T03:11:31.000Z,3,1,1,2,1,2,2,1,3,3,3,1,1,3,2,1,3,1,1,3,3,1,2,1,2,Ninguna,1,0,0,0,0,0,0,0
25968065-4,MIA PASCAL VALENTINA MORALES MANOSALBA,PRE-KINDER A,Daniela ,Colegio Salesianos Linares,2022-08-15T03:11:47.000Z,2,3,1,2,2,3,2,1,2,3,1,2,1,3,2,3,3,2,1,2,2,1,1,3,2,"Me preocupa lo dificil que se le ha hecho adaptarse al colegio, a los companeros.",3,2,3,1,4,4,4,3
26080694-7,AGUSTÍN IGNACIO PACHECO ALBORNOZ,PRE-KINDER A,Daniela ,Colegio Salesianos Linares,2022-08-15T03:12:03.000Z,3,3,1,2,2,1,2,1,2,3,3,2,1,3,2,1,3,1,1,2,2,1,2,2,2,No,1,0,0,0,0,0,0,0
26194901-6,IGNACIA PALMA RODRIGUEZ,PRE-KINDER A,Daniela ,Colegio Salesianos Linares,2022-08-15T03:12:03.000Z,3,1,1,3,1,1,3,2,3,2,2,1,1,3,2,2,3,1,0,3,2,1,1,1,2,Tiene poca tolerancia a la frustracion.,1,0,0,0,0,0,0,0
25781530-7,FERNANDA ELIZABETH PÉREZ GAJARDO,PRE-KINDER A,Daniela ,Colegio Salesianos Linares,2022-08-15T03:12:03.000Z,2,3,1,3,3,2,3,2,3,0,2,2,2,3,3,3,3,1,1,3,2,1,1,2,2,0,1,0,0,0,0,0,0,0
25977145-5,JOAQUÍN ANTONIO QUEZADA REBOLLEDO,PRE-KINDER A,Daniela ,Colegio Salesianos Linares,2022-08-15T03:12:03.000Z,3,3,1,3,2,2,2,1,3,3,3,2,1,3,2,1,3,2,1,3,3,1,1,2,2,0,2,2,2,2,1,2,1,2
25736711-8,CONSTANZA SCARLETT SÁEZ PACHECO,PRE-KINDER A,Daniela ,Colegio Salesianos Linares,2022-08-15T03:12:03.000Z,3,2,1,2,2,1,2,1,3,3,2,3,1,2,2,1,3,2,1,3,1,1,1,1,1,0,1,0,0,0,0,0,0,0
25732681-0,CELESTE ANTONIA ULLOA NAVARRETE,PRE-KINDER A,Daniela ,Colegio Salesianos Linares,2022-08-15T03:12:03.000Z,3,1,1,3,2,1,1,1,3,2,3,1,1,3,1,3,3,1,1,3,2,1,1,2,3,No,1,0,0,0,0,0,0,0
25881024-4,IGNACIO NICOLÁS VÁSQUEZ VEGA,PRE-KINDER A,Daniela ,Colegio Salesianos Linares,2022-08-15T03:12:03.000Z,3,2,2,2,2,0,3,1,2,3,2,1,1,2,2,1,3,2,1,3,0,1,2,2,2,0,1,0,0,0,0,0,0,0
25841899-9,BENJAMÍN ARTURO VÁSQUEZ GARRIDO,PRE-KINDER A,Daniela ,Colegio Salesianos Linares,2022-08-15T03:12:03.000Z,2,3,1,1,3,3,1,1,3,3,1,3,1,3,3,2,3,3,1,3,1,1,2,1,1,"Me preocupa que no es obediente, hiperactivo, se distrae con faciliad, tiene retraso en lenguaje, le cuesta comunicarse",3,3,3,3,3,4,1,3
26055463-8,TOMÁS EMILIO VERDEJO NORAMBUENA,PRE-KINDER A,Daniela ,Colegio Salesianos Linares,2022-08-15T03:12:03.000Z,2,2,1,2,2,2,2,1,3,3,3,1,1,3,1,1,3,1,1,3,2,1,1,1,3,0,1,0,0,0,0,0,0,2
26136827-7,JULIÁN DE JESÚS VILLAR PONCE,PRE-KINDER A,Daniela ,Colegio Salesianos Linares,2022-08-15T03:12:03.000Z,3,2,1,3,1,1,3,1,3,2,3,1,1,3,2,1,0,1,1,3,2,1,2,1,3,0,1,0,0,1,1,1,2,1
26066757-2,SOFÍA VALENTINA ÁGUILA AGUILERA,PRE-KINDER B,Daniela ,Colegio Salesianos Linares,2022-08-16T03:41:45.000Z,3,2,2,3,2,2,3,1,3,2,2,2,2,3,2,1,3,1,2,3,2,1,1,2,2,0,1,0,0,0,0,0,0,0
25912327-5,ALMA MAGDALENA ALBORNOZ GUTIÉRREZ,PRE-KINDER B,Daniela ,Colegio Salesianos Linares,2022-08-16T03:41:45.000Z,3,2,1,3,1,1,2,1,3,2,3,1,1,3,2,1,3,1,1,3,3,1,2,1,3,"Por favor, no exponerla tanto tiempo a la pantalla del tablet, ya que se le irritan sus ojos.",1,0,0,0,0,0,0,0
25952376-1,SANTINO ALONSO ALDEA FUENTES,PRE-KINDER B,Daniela ,Colegio Salesianos Linares,2022-08-16T03:41:45.000Z,3,3,1,2,2,1,2,1,2,3,3,2,1,2,3,1,3,1,2,1,2,1,1,1,2,Santino se distrae con facilidades y en ocasiones no obedece ordenes cuando se le habla de forma directa.,2,3,2,2,1,3,1,2
26061999-3,MATILDA AMPARO ALMUNA GANGA,PRE-KINDER B,Daniela ,Colegio Salesianos Linares,2022-08-16T03:41:45.000Z,3,1,1,2,1,2,3,2,3,1,2,1,2,2,1,2,2,1,1,3,2,1,2,1,2,A mi hija le dificulta expresar sus emociones. A veces tiene dificultades y no dice que cosas le sucede.,2,2,3,3,2,2,2,3
25919463-6,ANYSSA AMALIA CASTRO CASTILLO,PRE-KINDER B,Daniela ,Colegio Salesianos Linares,2022-08-16T03:41:45.000Z,2,2,2,2,1,1,2,1,2,0,0,0,1,2,2,1,3,0,2,2,0,1,2,1,2,"No tengo ningun comentario, solo agradecer.",2,3,1,2,1,2,1,2
26134512-9,AYLEN AMARAL CEA VILLALOBOS,PRE-KINDER B,Daniela ,Colegio Salesianos Linares,2022-08-16T03:41:45.000Z,3,2,2,2,2,1,2,2,3,2,2,1,1,2,2,2,3,2,1,3,2,1,2,2,2,0,2,3,1,2,1,0,1,2
25956865-k,AGUSTÍN ALEJANDRO CISTERNA GÚZMAN,PRE-KINDER B,Daniela ,Colegio Salesianos Linares,2022-08-16T03:41:45.000Z,2,3,1,2,1,2,2,1,3,2,2,1,1,3,2,1,3,1,1,3,3,1,1,1,1,"No, ninguno.",2,2,1,1,1,1,1,1
26168829-8,JOSEFINA IGNACIA COFRÉ ARANCIBIA,PRE-KINDER B,Daniela ,Colegio Salesianos Linares,2022-08-16T03:41:45.000Z,3,2,1,3,2,1,2,1,2,3,3,1,1,3,2,1,3,2,1,3,3,1,2,2,3,0,1,0,0,0,0,0,0,0
26128921-0,MARTÍN ALONSO CONTRERAS DOMÍNGUEZ,PRE-KINDER B,Daniela ,Colegio Salesianos Linares,2022-08-16T03:41:45.000Z,3,2,1,2,2,2,2,1,3,2,2,1,1,2,2,2,2,1,1,2,2,1,2,2,2,"Solo que mi hijo se distrae al menos cuando hace tareas converza o se demora, sera un tema de concentracion",2,2,2,2,1,1,2,1
26163418-k,DIEGO ANTONIO FREIRE URRUTIA,PRE-KINDER B,Daniela ,Colegio Salesianos Linares,2022-08-16T03:41:45.000Z,2,3,1,2,2,3,3,1,2,3,3,1,1,2,2,2,2,1,1,3,2,1,3,2,2,0,2,3,2,2,2,2,1,1
25794006-3,AGUSTINA DE JESÚS GAJARDO YÁÑEZ,PRE-KINDER B,Daniela ,Colegio Salesianos Linares,2022-08-16T03:41:45.000Z,3,2,1,3,1,1,2,1,3,1,3,1,1,2,2,1,3,1,1,3,3,1,2,1,2,0,0,0,0,0,0,0,0,1
25992816-8,JOSEFINA ANAÍS HERNÁNDEZ ROCA,PRE-KINDER B,Daniela ,Colegio Salesianos Linares,2022-08-16T03:42:01.000Z,3,2,1,3,2,1,2,1,3,2,2,1,1,3,2,2,3,1,1,3,2,1,1,1,2,0,2,1,2,1,1,2,2,1
25809311-9,GERARDO LYAN DE JESÚS HORMAZÁBAL SANTANA,PRE-KINDER B,Daniela ,Colegio Salesianos Linares,2022-08-16T03:42:01.000Z,3,3,1,2,2,1,3,1,3,3,2,1,1,2,3,1,3,1,1,2,1,1,1,1,2,0,0,0,0,2,1,2,2,1
25817902-1,MATEO ALONSO HORMAZÁBAL OSORIO,PRE-KINDER B,Daniela ,Colegio Salesianos Linares,2022-08-16T03:42:01.000Z,2,3,1,3,2,1,2,1,2,3,3,1,1,3,2,2,3,1,2,2,1,1,1,2,2,0,2,3,1,1,1,2,1,1
26005303-5,VICENTE ALONZO JIMÉNEZ SANHUEZA,PRE-KINDER B,Daniela ,Colegio Salesianos Linares,2022-08-16T03:42:01.000Z,3,2,1,3,3,1,2,2,3,2,2,1,2,3,2,1,3,1,1,2,1,1,1,1,2,0,1,0,0,0,0,0,0,0
25739251-1,ANTHONELLA BELÉN LÓPEZ MÉNDEZ,PRE-KINDER B,Daniela ,Colegio Salesianos Linares,2022-08-16T03:42:01.000Z,2,1,1,3,2,1,2,1,3,2,1,1,1,3,2,2,3,1,1,2,2,1,2,2,2,0,2,3,2,2,1,1,2,2
25770057-7,EMILY MAYLEN LÓPEZ CABRERA,PRE-KINDER B,Daniela ,Colegio Salesianos Linares,2022-08-16T03:42:01.000Z,3,2,2,2,2,2,3,1,3,2,3,1,1,3,1,1,3,3,3,3,2,1,1,2,3,0,1,0,0,1,1,1,1,1
25938650-0,BENJAMÍN IGNACIO NORAMBUENA MUÑOZ,PRE-KINDER B,Daniela ,Colegio Salesianos Linares,2022-08-16T03:42:01.000Z,3,2,1,3,2,1,2,1,3,2,2,1,1,2,2,1,2,1,1,2,2,1,1,1,1,0,1,0,0,0,0,0,0,0
25725748-7,VICTORIA ARIELA NORAMBUENA CÁCERES,PRE-KINDER B,Daniela ,Colegio Salesianos Linares,2022-08-16T03:42:01.000Z,3,2,1,3,2,1,3,1,3,2,3,2,0,1,3,1,1,2,3,2,1,2,2,2,2,0,1,0,1,2,2,2,2,1
25858352-3,VICENTE ANDRE ORELLANA CISTERNA,PRE-KINDER B,Daniela ,Colegio Salesianos Linares,2022-08-16T03:42:01.000Z,2,3,1,2,2,3,3,1,3,3,2,1,2,3,3,2,3,3,2,3,3,1,3,1,2,0,3,3,3,3,2,4,1,3
25885799-2,MATÍAS ALEJANDRO PÉREZ URRUTIA,PRE-KINDER B,Daniela ,Colegio Salesianos Linares,2022-08-16T03:42:01.000Z,2,2,2,2,3,3,2,1,3,3,1,1,1,2,3,2,3,2,1,3,2,1,3,2,1,0,2,3,1,1,2,2,1,1
25747912-9,BRUNO ESTEBAN REBOLLEDO CÁRCAMO,PRE-KINDER B,Daniela ,Colegio Salesianos Linares,2022-08-16T03:42:01.000Z,2,1,1,2,2,1,2,1,2,1,1,1,1,2,2,2,3,1,1,1,2,1,1,1,2,0,3,3,2,1,2,2,2,2
26060035-4,SEBASTIÁN ALEXIS RETAMAL LEÓN,PRE-KINDER B,Daniela ,Colegio Salesianos Linares,2022-08-16T03:42:01.000Z,3,3,1,2,2,1,2,1,3,2,3,1,1,3,2,1,3,1,1,2,1,1,2,1,2,No,1,0,0,0,0,0,0,0
25976445-9,VICENTE ALONSO SALAS VAYCCETTES,PRE-KINDER B,Daniela ,Colegio Salesianos Linares,2022-08-16T03:42:01.000Z,3,3,1,3,2,1,2,2,3,2,1,1,1,3,2,1,3,1,2,3,2,1,1,1,1,0,2,1,2,1,1,2,1,1
25860524-1,ALEJANDRO ISAIAS SALDAÑO ROJAS,PRE-KINDER B,Daniela ,Colegio Salesianos Linares,2022-08-16T03:42:01.000Z,3,3,2,3,2,2,2,2,3,3,3,1,1,2,3,2,3,2,2,3,2,1,2,3,1,"Nosotros como pafres estamos preocupados, ya que, alejandro es un nino inseguro y tiende a tartamudear de vez en cundo.",2,3,2,2,1,0,2,2
25810694-6,FLORENCIA ANTONIA TAPIA JAMETT,PRE-KINDER B,Daniela ,Colegio Salesianos Linares,2022-08-16T03:42:01.000Z,3,1,1,2,1,1,3,1,3,3,2,0,1,3,1,1,3,1,1,3,2,1,1,1,2,"No, florencia todo bien de acurdo a su edad.",1,0,0,0,0,0,0,0
26161787-0,LEONOR ISABELLA TAPIA RODRÍGUEZ,PRE-KINDER B,Daniela ,Colegio Salesianos Linares,2022-08-16T03:42:02.000Z,3,1,1,3,2,1,3,1,3,1,2,1,1,3,2,1,3,1,1,2,2,1,2,1,2,0,0,0,0,0,0,0,0,0
25758567-0,GASPAR MATEO RUIZ MORALES,PRE-KINDER B,Daniela ,Colegio Salesianos Linares,2022-08-16T03:42:02.000Z,3,2,1,2,2,1,2,1,3,2,2,1,3,3,1,1,3,1,1,3,2,1,1,2,3,0,2,2,2,2,2,1,1,1
26097535-8,BRUNO ALEXANDER VALDÉS ACUÑA,PRE-KINDER B,Daniela ,Colegio Salesianos Linares,2022-08-16T03:43:05.000Z,3,2,1,3,2,3,3,2,3,3,3,1,2,3,2,1,3,2,1,3,3,1,3,1,2,0,2,1,2,2,1,1,1,1
25824599-7,AMPARO DE JESÚS VALENZUELA OPAZO,PRE-KINDER B,Daniela ,Colegio Salesianos Linares,2022-08-16T03:43:05.000Z,3,2,1,2,1,2,2,1,3,2,1,1,1,3,3,1,3,1,1,3,2,1,1,2,2,0,1,0,0,0,0,0,0,0
25833658-5,MATEO ALONSO VILLALOBOS FLORES,PRE-KINDER B,Daniela ,Colegio Salesianos Linares,2022-08-16T03:43:05.000Z,2,3,2,2,3,2,1,1,2,3,2,2,2,2,3,2,3,1,2,2,1,1,3,2,1,"Mi preocupacion, es que mi hijo es muy inquieto, y no presta atencion.",3,3,3,3,3,3,3,3
25956267-8,LUCAS JOAQUÍN ALARCÓN GONZÁLEZ,PRE-KINDER ,Daniela ,Colegio María Auxiliadora de Linares,2022-08-16T07:02:43.000Z,3,2,2,3,1,2,3,1,2,2,1,1,1,2,1,1,3,1,1,3,2,1,1,2,2,0,1,0,0,0,0,0,0,0
25831291-0,PÍA ISIDORA ARAVENA ZURITA,PRE-KINDER ,Daniela ,Colegio María Auxiliadora de Linares,2022-08-16T07:02:43.000Z,3,2,1,3,2,1,3,1,3,2,3,1,1,3,2,1,3,1,1,3,3,1,2,2,2,0,1,0,0,0,0,0,0,0
26131126-7,ELIÁN IGNACIO ARAVENA POBLETE,PRE-KINDER ,Daniela ,Colegio María Auxiliadora de Linares,2022-08-16T07:02:43.000Z,3,2,1,1,2,3,2,1,1,2,3,1,1,2,3,3,3,1,1,1,1,1,3,2,1,Es u nino que le cuesta comprender y se distrae con facilidad.,3,3,2,2,3,4,2,3
25944426-8,DIEGO ANDRÉS BASCUÑÁN URRUTIA,PRE-KINDER ,Daniela ,Colegio María Auxiliadora de Linares,2022-08-16T07:02:44.000Z,3,0,2,2,3,1,2,2,2,3,1,2,0,2,3,3,2,1,1,1,1,1,2,3,2,Todo ruido fuerte le molesta,3,3,3,4,2,2,3,1
25809827-7,SAMUEL ANTONIO BENAVIDES QUEZADA,PRE-KINDER ,Daniela ,Colegio María Auxiliadora de Linares,2022-08-16T07:02:44.000Z,3,2,1,0,1,2,3,1,2,2,3,2,1,3,2,0,3,1,1,3,2,1,0,1,2,Ninguno,1,0,0,0,0,0,0,0
25886413-1,PEDRO ISAAC HERNÁNDEZ LAGOS,PRE-KINDER ,Daniela ,Colegio María Auxiliadora de Linares,2022-08-16T07:02:44.000Z,3,2,1,2,1,2,3,1,1,2,1,1,1,1,2,2,3,1,2,2,2,1,2,2,2,0,1,0,2,0,0,0,0,0
25884052-6,LAURA EMILIA CERDA ORTEGA,PRE-KINDER ,Daniela ,Colegio María Auxiliadora de Linares,2022-08-16T07:02:44.000Z,3,2,3,3,1,1,2,1,3,3,3,1,1,3,2,2,3,3,1,2,1,1,1,2,2,No ninguno,1,0,0,0,0,0,0,1
26044746-7,AGUSTÍN ALFONSO ESCALONA TRINCADO,PRE-KINDER ,Daniela ,Colegio María Auxiliadora de Linares,2022-08-16T07:02:44.000Z,3,2,1,2,2,1,3,1,2,2,2,1,1,3,1,1,3,1,1,2,2,1,1,1,3,0,1,0,0,0,0,0,0,0
26168005-k,SEBASTIÁN ANTONIO FIGUEROA NORAMBUENA,PRE-KINDER ,Daniela ,Colegio María Auxiliadora de Linares,2022-08-16T07:02:44.000Z,3,1,1,3,1,2,1,1,3,2,3,1,1,3,2,1,3,1,1,3,2,1,2,2,2,"Mi hijo tiene hermanos pero solo vive con su madre. Sin mbargo es muy amistoso, tierno y buen comportamiento con todos.",1,0,1,1,1,1,1,1
25809726-2,AYLIN ANTONIA FIGUEROA ARAYA,PRE-KINDER ,Daniela ,Colegio María Auxiliadora de Linares,2022-08-16T07:02:44.000Z,3,3,2,2,2,1,2,1,3,3,2,1,1,3,2,2,3,1,1,3,2,1,1,3,2,0,1,0,0,0,0,0,0,0
26128870-2,ANTONELLA ALESSANDRA FUENTES VALLEJOS,PRE-KINDER ,Daniela ,Colegio María Auxiliadora de Linares,2022-08-16T07:02:44.000Z,3,2,1,3,2,1,3,1,3,2,3,1,2,3,2,2,3,1,1,3,2,1,3,1,2,"No, ningun comentario.",2,3,1,1,1,2,1,1
26053039-9,LUCIANO IVÁN GATICA CASTAÑEDA,PRE-KINDER ,Daniela ,Colegio María Auxiliadora de Linares,2022-08-16T07:02:44.000Z,2,2,1,2,3,2,2,1,2,2,2,2,1,3,2,1,1,1,1,3,2,1,1,1,2,"Solo, no se si es debido a la edad pero que le cuesta mucho manejar su frustracion y hace rabietas, se le paran, pero se frustarapido.",2,3,2,2,1,1,2,2
26147271-6,JOSÉ AGUSTÍN LARA TRONCOSO,PRE-KINDER ,Daniela ,Colegio María Auxiliadora de Linares,2022-08-16T07:02:44.000Z,3,1,1,2,2,2,2,1,3,1,2,1,1,3,2,1,3,1,1,2,3,1,2,2,3,0,2,3,1,1,2,1,1,1
26054128-5,LUIS ALFONSO MORALES BARROS,PRE-KINDER ,Daniela ,Colegio María Auxiliadora de Linares,2022-08-16T07:02:44.000Z,2,2,1,2,2,1,1,1,2,2,2,1,1,2,2,1,2,1,1,2,2,1,1,2,1,0,1,0,0,0,0,0,0,0
25964320-1,MAITE ANASTASIA PALMA PARRA,PRE-KINDER ,Daniela ,Colegio María Auxiliadora de Linares,2022-08-16T07:02:44.000Z,3,2,2,3,2,2,3,1,3,2,3,1,1,3,2,1,3,2,1,2,3,1,2,1,3,0,1,0,0,0,0,0,0,0
25989995-8,AGUSTÍN ALEJANDRO ROA ARELLANO,PRE-KINDER ,Daniela ,Colegio María Auxiliadora de Linares,2022-08-16T07:02:44.000Z,2,2,1,3,2,2,3,1,3,3,3,1,1,2,2,1,3,2,1,3,2,1,1,1,2,0,2,3,1,1,1,2,1,1
26162296-3,ADRIÁN ALEJANDRO RODRÍGUEZ MUÑOZ,PRE-KINDER ,Daniela ,Colegio María Auxiliadora de Linares,2022-08-16T07:02:44.000Z,3,2,1,3,2,1,2,1,3,2,3,1,1,3,1,1,3,1,1,2,2,1,2,1,2,0,0,0,1,0,0,0,0,1
26127747-6,ANTONIA IGNACIA SALDÍAS GODOY,PRE-KINDER ,Daniela ,Colegio María Auxiliadora de Linares,2022-08-16T07:02:44.000Z,3,3,1,2,3,1,3,2,2,3,2,1,1,3,3,1,3,2,1,3,2,1,1,1,2,0,2,3,2,4,2,2,3,1
25756642-0,RENATA VICTORIA SOTO CANALES,PRE-KINDER ,Daniela ,Colegio María Auxiliadora de Linares,2022-08-16T07:02:44.000Z,3,3,2,3,2,2,2,1,3,3,3,1,1,3,2,2,3,1,2,3,2,1,1,2,2,0,2,3,2,2,2,2,2,3
25910022-0,ROCÍO ANASTASIA VERGARA NUÑEZ,PRE-KINDER ,Daniela ,Colegio María Auxiliadora de Linares,2022-08-16T07:02:44.000Z,3,3,1,2,3,1,2,1,3,3,3,0,1,0,3,2,3,2,0,3,3,1,2,1,1,No,2,3,1,1,1,2,1,1
25.765.053-7,Joaquín Andrés Garrido Meza,PRE-KINDER ,Daniela ,Colegio Lucila Godoy,2022-08-16T21:27:52.000Z,3,3,1,2,2,1,2,1,2,3,3,1,1,2,2,2,3,1,1,2,2,1,1,3,2,0,1,0,0,0,0,0,0,0
25.841.256-7,Matteo Alberto Guerrero Barros,PRE-KINDER ,Daniela ,Colegio Lucila Godoy,2022-08-16T21:28:04.000Z,2,3,1,2,2,2,2,2,3,3,2,2,1,3,3,3,3,2,2,3,2,1,2,2,2,0,2,2,3,2,3,3,2,2
25.941.149-1,Florencia Paz Muñoz Troncoso,PRE-KINDER ,Daniela ,Colegio Lucila Godoy,2022-08-16T21:29:01.000Z,3,3,1,3,1,1,1,1,3,3,3,0,1,3,3,1,3,1,1,1,1,1,1,1,1,0,3,3,1,1,1,4,1,1
26.075.828-4,Mateo Alonso Novoa Ampuero,PRE-KINDER ,Daniela ,Colegio Lucila Godoy,2022-08-16T21:29:01.000Z,2,3,1,1,3,2,1,2,2,3,1,1,2,2,3,2,2,1,3,2,1,1,2,3,1,"Preocupacion porque no escucha a nadie, no entiende nada cuando le hablamos.",3,3,2,2,1,2,2,2
25.810.992-9,Lucas Ignacio Pacheco Medina,PRE-KINDER ,Daniela ,Colegio Lucila Godoy,2022-08-16T21:29:01.000Z,2,3,1,2,2,1,2,2,3,3,2,2,2,2,2,1,3,1,1,2,2,2,2,1,2,0,2,3,1,1,2,2,1,1
25.723.176-3,Magdalena Antonia Quiroz Bravo,PRE-KINDER ,Daniela ,Colegio Lucila Godoy,2022-08-16T21:29:01.000Z,3,2,3,3,2,2,3,2,3,2,3,1,2,3,2,2,3,1,2,3,3,1,2,3,3,Mi hija llora todos los dias para ingresar al colegio.,2,2,2,2,1,1,1,2
26.060.819-3,Florencia Ignacia Ramirez Flores,PRE-KINDER ,Daniela ,Colegio Lucila Godoy,2022-08-16T21:29:01.000Z,3,1,2,2,2,2,3,2,2,2,1,1,2,2,2,2,3,1,2,3,2,1,3,3,3,"Me preocupa mucho que le tenga tanto miedo a los perros,  ella puede llegar a no controlar su miedo a ellos.",2,3,3,2,2,2,2,3
25.849.123-8,Santino Alonso Retamal Ibáñez,PRE-KINDER ,Daniela ,Colegio Lucila Godoy,2022-08-16T21:29:01.000Z,3,3,1,2,1,1,2,1,3,3,3,1,1,3,3,1,3,3,1,3,1,1,1,2,1,0,2,3,2,2,1,2,2,1
25.844.536-8,Julieta Paz Reyes Orellana,PRE-KINDER ,Daniela ,Colegio Lucila Godoy,2022-08-16T21:29:01.000Z,3,2,1,2,3,2,1,2,2,2,3,2,1,2,2,2,2,2,2,2,2,1,2,2,2,0,2,3,3,1,2,2,2,3
26.052.985-4,Aylin Isidora Rodriguez Escalona,PRE-KINDER ,Daniela ,Colegio Lucila Godoy,2022-08-16T21:29:01.000Z,3,2,1,3,2,2,2,1,3,2,3,1,1,3,2,2,3,1,2,2,2,1,2,2,2,"si, timides de mi hija al iniciar la salida de casa al colegio, ya que psaba siempre conmigo en casa.",2,2,2,1,2,2,1,1
